column_name,column_type,description,possible_values
_STATE,DOUBLE,State FIPS Code,{'39': 'Ohio'}
_GEOSTR,DOUBLE,Geographic Stratum Code,{'HIDDEN': 'Data not displayed'}
_DENSTR2,DOUBLE,Household Density Stratum Code,"{'1': 'Listed', '2': 'Unlisted'}"
PRECALL,DOUBLE,Pre-Call Status Code,{'1': 'To be called'}
SECSCRFL,DOUBLE,Secondary Screening Flags,"{'1': 'No Answer', '2': 'Busy', '3': 'Fax/Modem', '5': 'Privacy Manager', '6': 'Residential Voice', '7': 'Residence/Phone', 'BLANK': 'Missing or Not'}"
REPNUM,DOUBLE,Replicate Number,"{'1': '010001-019999', '2': '020001-029999', '3': '030001-039999', '4': '040001-049999', '5': '050001-059999', '6': '060001-069999', '7': '070001-079999', '8': '080001-089999', '9': '090001-099999', '10': '100001-109999', '11': '110001-119999', '12': '120001-129999'}"
REPDEPTH,DOUBLE,Replicate Depth,"{'1': 'Replicate Depth', '2': '459', '3': '411', '4': '462', '5': '451', '6': '427', '7': '437', '8': '449', '9': '447', '10': '464', '11': '446', '12': '415', '13': '459', '14': '434', '15': '445', '16': '435', '17': '451', '18': '454', '19': '480', '20': '455', '21': '460', '22': '456', '23': '433', '24': '446', '25': '438', '26': '398', '27': '440', '28': '455', '29': '454', '30': '464'}"
FMONTH,DOUBLE,File Month,"{'1': 'January', '2': 'February', '3': 'March', '4': 'April', '5': 'May', '6': 'June', '7': 'July', '8': 'August', '9': 'September', '10': 'October', '11': 'November', '12': 'December'}"
IDATE,VARCHAR,Interview Date,"{'1': '01012023-01312023', '2': '02012023-02292023', '3': '03012023-03312023', '4': '04012023-04302023', '5': '05012023-05312023', '6': '06012023-06302023', '7': '07012023-07312023', '8': '08012023-08312023', '9': '09012023-09302023', '10': '10012023-10312023', '11': '11012023-11302023', '12': '12012023-12312023', '13': 'Collected in'}"
IMONTH,VARCHAR,Interview Month,"{'1': 'January', '2': 'February', '3': 'March', '4': 'April', '5': 'May', '6': 'June', '7': 'July', '8': 'August', '9': 'September', '10': 'October', '11': 'November', '12': 'December'}"
IDAY,VARCHAR,Interview Day,"{'1': 'Interview Day', '2': '481', '3': '678', '4': '494', '5': '470', '6': '422', '7': '423', '8': '543', '9': '494', '10': '497', '11': '434', '12': '358', '13': '445', '14': '437', '15': '477', '17': '473', '18': '442', '19': '359', '20': '419', '21': '522', '22': '356', '23': '281', '24': '326', '25': '307', '26': '432', '27': '534', '28': '526', '29': '252', '30': '257', '31': '301'}"
IYEAR,BIGINT,Interview Year,{}
INTVID,VARCHAR,Interviewer Identification,{'HIDDEN': 'Data not displayed'}
DISPCODE,DOUBLE,Final Disposition,{}
SEQNO,BIGINT,Annual Sequence Number,{'HIDDEN': 'Data not displayed'}
_PSU,DOUBLE,Primary Sampling Unit (Equal to Annual Sequence Number),{'HIDDEN': 'Data not displayed'}
NATTMPTS,DOUBLE,Description not found,{}
NRECSEL,DOUBLE,Number of Sample Records Selected from Stratum,{'HIDDEN': 'Data not displayed'}
NRECSTR,DOUBLE,Number of Telephone Numbers in Stratum from Which Sample Was Selected,{'HIDDEN': 'Data not displayed'}
CTELENM1,DOUBLE,Is this (phone number) ?,"{'1': 'Yes—Go to LL.02,', 'BLANK': 'Missing'}"
PVTRESD1,DOUBLE,"Is this a private residence? [READ ONLY IF NECESSARY: “By private residence, we mean someplace like a house","{'1': 'Yes—Go to LL.04,', '2': 'No—Go to LL.03,', 'BLANK': 'Missing'}"
COLGHOUS,DOUBLE,Do you live in college housing?,"{'1': 'Yes—Go to LL.04,', 'BLANK': 'Missing'}"
STATERE1,DOUBLE,Do you currently live in ____(state)____?,"{'1': 'Yes—Go to LL.05,', 'BLANK': 'Not asked or'}"
CELPHON1,DOUBLE,Is this a cell telephone?,"{'2': 'Not a cell phone—', 'BLANK': 'Missing or Cell'}"
LADULT1,DOUBLE,Are you 18 years of age or older?,"{'1': 'Yes—If LL.03,', 'BLANK': 'Not asked or'}"
NUMADULT,DOUBLE,"I need to randomly select one adult who lives in your household to be interviewed. Excluding adults living away from home,","{'1': 'Number of adults', '2': 'Number of adults', '3': 'Number of adults', '4': 'Number of adults', '5': 'Number of adults', '6': '-', 'BLANK': 'Missing'}"
RESPSLC1,DOUBLE,The person in your household that I need to speak with is the adult with the most recent birthday. Are you the,"{'1': 'Yes', 'BLANK': 'Not asked or'}"
LANDSEX2,DOUBLE,Are you?,"{'1': 'Male', '2': 'Female', '3': 'Unspecified or', 'BLANK': 'Not asked or'}"
LNDSXBRT,DOUBLE,What was your sex at birth? Was it male or female?,"{'1': 'or', '2': 'Female', 'BLANK': 'Not asked or'}"
SAFETIME,DOUBLE,Is this a safe time to talk with you?,"{'1': 'Yes—Go to CP.02,', 'BLANK': 'Not asked or'}"
CTELNUM1,DOUBLE,Is this (phone number) ?,"{'1': 'Yes—Go to CP.03,'}"
CELLFON5,DOUBLE,Is this a cell phone?,"{'1': 'Yes—Go to CP.04,', 'BLANK': 'Not asked or'}"
CADULT1,DOUBLE,Are you 18 years of age or older?,"{'1': 'Yes—Go to CP.05,', 'BLANK': 'Not asked or'}"
CELLSEX2,DOUBLE,Are you?,"{'1': 'Male—Go to CP.07,', '2': 'Female—Go to', '3': 'Unspecified or', '7': 'Don’t know/Not', '9': 'Refused—Go to', 'BLANK': 'Not asked or'}"
CELSXBRT,DOUBLE,What was your sex at birth? Was it male or female?,"{'1': 'or', '2': 'Female—Go to', 'BLANK': 'Not asked or'}"
PVTRESD3,DOUBLE,"Do you live in a private residence? (By private residence, we mean someplace like a house or apartment.)","{'1': 'Yes—Go to CP.09,', '2': 'No—Go to CP.08,', 'BLANK': 'Not asked or', '7': 'or'}"
CCLGHOUS,DOUBLE,Do you live in college housing?,"{'1': 'Yes—Go to CP.09,', 'BLANK': 'Missing'}"
CSTATE1,DOUBLE,Do you currently live in ____(state)____?,"{'1': 'Yes—Go to CP.11,', '2': 'No—Go to CP.10,', 'BLANK': 'Not asked or'}"
RSPSTAT1,DOUBLE,In what state do you currently live?,"{'39': 'Ohio', 'BLANK': 'Not asked or'}"
LANDLINE,DOUBLE,Do you also have a landline telephone in your home that is used to make and receive calls?,"{'1': 'Yes', '2': 'No', '7': 'Don’t know/Not', '9': 'Refused', 'BLANK': 'Not asked or', '77': 'or'}"
HHADULT,DOUBLE,"How many members of your household, including yourself, are 18 years of age or older?","{'1': '-', '77': 'or', '99': 'Refused', 'BLANK': 'Not asked or'}"
SEXVAR,DOUBLE,Sex of Respondent,"{'1': 'Male—Code=1 if', '2': 'Female—Code=2 if'}"
GENHLTH,DOUBLE,Would you say that in general your health is:,"{'1': 'Excellent', '2': 'Very good', '3': 'Good', '4': 'Fair', '5': 'Poor', '7': 'Don’t know/Not', '9': 'Refused'}"
PHYSHLTH,DOUBLE,"Now thinking about your physical health, which includes physical illness and injury, for how many days during","{'1': '-', '88': 'None', '77': 'Don’t know/Not', '99': 'Refused'}"
MENTHLTH,DOUBLE,"Now thinking about your mental health, which includes stress, depression, and problems with emotions, for how","{'1': '-', '88': 'None', '77': 'Don’t know/Not', '99': 'Refused'}"
POORHLTH,DOUBLE,"During the past 30 days, for about how many days did poor physical or mental health keep you from doing your","{'1': '-', '88': 'None', '77': 'Don’t know/Not', '99': 'Refused', 'BLANK': 'Not asked or'}"
PRIMINS1,DOUBLE,What is the current source of your primary health insurance?,"{'1': 'A plan purchased', '2': 'A private', '3': 'Medicare', '4': 'Medigap', '5': 'Medicaid', '6': 'Children´s Health', '7': 'Military related', '8': 'Indian Health', '9': 'State sponsored', '10': 'Other government', '88': 'No coverage of any', '77': 'Don’t know/Not', '99': 'Refused'}"
PERSDOC3,DOUBLE,Do you have one person (or a group of doctors) that you think of as your personal health care provider?,"{'1': 'Yes, only one', '2': 'More than one', '3': 'No', '7': 'Don’t know/Not', '9': 'Refused'}"
MEDCOST1,DOUBLE,Was there a time in the past 12 months when you needed to see a doctor but could not because you could not afford it?,"{'1': 'Yes', '2': 'No', '7': 'Don’t know/Not', '9': 'Refused'}"
CHECKUP1,DOUBLE,About how long has it been since you last visited a doctor for a routine checkup?,"{'1': 'Within past year', '12': 'months', '2': 'Within past', '3': 'Within past', '4': '5 or more years', '7': 'Don’t know/Not', '8': 'Never', '9': 'Refused'}"
EXERANY2,DOUBLE,"During the past month, other than your regular job, did you participate in any physical activities or exercises such","{'1': 'Yes', '2': 'No—Go to Section', '7': 'Don’t know/Not', '9': 'Refused—Go to'}"
EXRACT12,DOUBLE,What type of physical activity or exercise did you spend the most time doing during the past month?,"{'1': 'Walking', '2': 'Running or jogging', '3': 'Gardening or yard', '4': 'Bicycling or', '5': 'Aerobics video or', '6': 'Calisthenics', '7': 'Elliptical/EFX', '8': 'Household', '9': 'Weight lifting', '10': 'Yoga, Pilates, or', '11': 'Other', '77': 'Don’t know/Not', '99': 'Refused—Go to', 'BLANK': 'Not asked or'}"
EXEROFT1,DOUBLE,How many times per week or per month did you take part in this activity during the past month?,{'BLANK': 'Not asked or'}
EXERHMM1,DOUBLE,"And when you took part in this activity, for how many minutes or hours did you usually keep at it?","{'1': '-', 'BLANK': 'Not asked or'}"
EXRACT22,DOUBLE,What other type of physical activity gave you the next most exercise during the past month?,"{'1': 'Walking', '2': 'Running or jogging', '3': 'Gardening or yard', '5': 'Aerobics video or', '6': 'Calisthenics', '7': 'Elliptical/EFX', '8': 'Household', '9': 'Weight lifting', '10': 'Yoga, Pilates, or', '11': 'Other', '88': 'No other activity—', '77': 'Don’t know/Not', '99': 'Refused—Go to', 'BLANK': 'Not asked or'}"
EXEROFT2,DOUBLE,How many times per week or per month did you take part in this activity during the past month?,"{'BLANK': 'Not asked or', '77': '99'}"
EXERHMM2,DOUBLE,"And when you took part in this activity, for how many minutes or hours did you usually keep at it?","{'1': '-', 'BLANK': 'Not asked or', '77': '99'}"
STRENGTH,DOUBLE,"During the past month, how many times per week or per month did you do physical activities or exercises to",{}
BPHIGH6,DOUBLE,"Have you ever been told by a doctor, nurse or other health professional that you have high blood pressure? (If ´Yes","{'1': 'Yes', '2': 'Yes, but female', '3': 'No—Go to Section', '4': 'Told borderline', '7': 'Don´t know/Not', '9': 'Refused—Go to'}"
BPMEDS1,DOUBLE,Are you currently taking prescription medicine for your high blood pressure?,"{'1': 'Yes', '2': 'No', '7': 'Don’t know/Not', '9': 'or', 'BLANK': 'Not asked or'}"
CHOLCHK3,DOUBLE,About how long has it been since you last had your cholesterol checked?,"{'1': 'Never—Go to', '2': 'Within the past', '3': 'Within the past', '4': 'Within the past', '5': 'Within the past', '6': 'Within the past', '7': 'Don’t know/Not', '8': '5 or more years'}"
TOLDHI3,DOUBLE,"Have you ever been told by a doctor, nurse or other health professional that your cholesterol is high?","{'1': 'Yes', '2': 'No', '7': 'Don’t know/Not', '9': 'Refused', 'BLANK': 'Not asked or'}"
CHOLMED3,DOUBLE,Are you currently taking medicine prescribed by your doctor or other health professional for your cholesterol?,"{'1': 'Yes', '2': 'No', '7': 'Don’t know/Not', '9': 'Refused', 'BLANK': 'Not asked or'}"
CVDINFR4,DOUBLE,"(Ever told) you had a heart attack, also called a myocardial infarction?","{'1': 'Yes', '2': 'No', '7': 'Don’t know/Not', '9': 'Refused'}"
CVDCRHD4,DOUBLE,(Ever told) (you had) angina or coronary heart disease?,"{'1': 'Yes', '2': 'No', '7': 'Don’t know/Not', '9': 'Refused'}"
CVDSTRK3,DOUBLE,(Ever told) (you had) a stroke.,"{'1': 'Yes', '2': 'No', '7': 'Don’t know/Not', '9': 'Refused'}"
ASTHMA3,DOUBLE,(Ever told) (you had) asthma?,"{'1': 'Yes', '2': 'No—Go to Section', '7': 'Don’t know/Not', '9': 'Refused—Go to'}"
ASTHNOW,DOUBLE,Do you still have asthma?,"{'1': 'Yes', '2': 'No', '7': 'Don’t know/Not', '9': 'Refused', 'BLANK': 'Not asked or'}"
CHCSCNC1,DOUBLE,(Ever told) (you had) skin cancer that is not melanoma?,"{'1': 'Yes', '2': 'No', '7': 'Don’t know / Not', '9': 'Refused'}"
CHCOCNC1,DOUBLE,(Ever told) (you had) melanoma or any other types of cancer?,"{'1': 'Yes', '2': 'No', '7': 'Don’t know / Not', '9': 'Refused'}"
CHCCOPD3,DOUBLE,"(Ever told) (you had) C.O.P.D. (chronic obstructive pulmonary disease), emphysema or chronic bronchitis?","{'1': 'Yes', '2': 'No', '7': 'Don’t know / Not', '9': 'Refused'}"
ADDEPEV3,DOUBLE,"(Ever told) (you had) a depressive disorder (including depression, major depression, dysthymia, or minor depression)?","{'1': 'Yes', '2': 'No', '7': 'Don’t know/Not', '9': 'Refused'}"
CHCKDNY2,DOUBLE,"Not including kidney stones, bladder infection or incontinence, were you ever told you had kidney disease?","{'1': 'Yes', '2': 'No', '7': 'Don’t know / Not', '9': 'Refused'}"
HAVARTH4,DOUBLE,"(Ever told) (you had) some form of arthritis, rheumatoid arthritis, gout, lupus, or fibromyalgia? (Arthritis diagnoses include:","{'1': 'Yes', '2': 'No', '7': 'Don’t know/Not', '9': 'Refused'}"
DIABETE4,DOUBLE,"(Ever told) (you had) diabetes? (If ´Yes´ and respondent is female, ask ´Was this only when you were pregnant?´.","{'1': 'Yes', '2': 'Yes, but female', '3': 'No—Go to Section', '4': 'No, pre-diabetes', '7': 'Don’t know/Not', '9': 'Refused—Go to'}"
DIABAGE4,DOUBLE,Description not found,{}
AGE,DOUBLE,What is your age?,"{'7': 'Don’t know/Not', '9': 'Refused', '18': '-', '25': '-', '35': '-', '45': '-', '55': '-', '65': '-'}"
HISPANC3,BIGINT,"Are you Hispanic, Latino/a, or Spanish origin? (One or more categories may be selected.)","{'1': 'Mexican, Mexican', '2': 'Puerto Rican', '3': 'Cuban', '4': 'Another Hispanic,', '5': 'No', '6': 'Multiple', '7': 'Don’t know/Not', '9': 'Refused'}"
MRACE1,DOUBLE,Which one or more of the following would you say is your race?,"{'10': 'White', '20': 'Black or African', '30': 'American Indian or', '40': 'Asian', '41': 'Asian Indian', '42': 'Chinese', '43': 'Filipino', '44': 'Japanese', '45': 'Korean', '46': 'Vietnamese', '47': 'Other Asian', '51': 'Native Hawaiian', '53': 'Samoan', '54': 'Other Pacific', '60': 'Other', '75': 'is', '88': 'No additional', '77': 'Don’t know/Not', '99': 'Refused'}"
MARITAL,DOUBLE,Are you: (marital status),"{'1': 'Married', '2': 'Divorced', '3': 'Widowed', '4': 'Separated', '5': 'Never married', '6': 'A member of an', '9': 'Refused'}"
EDUCA,DOUBLE,What is the highest grade or year of school you completed?,"{'1': 'Never attended', '2': 'Grades', '3': 'years', '11': '(Some', '4': 'Grade', '5': 'College', '6': 'College'}"
RENTHOM1,DOUBLE,Do you own or rent your home?,"{'1': 'Own', '2': 'Rent', '3': 'Other arrangement', '7': 'Don’t know/Not', '9': 'Refused'}"
CTYCODE2,DOUBLE,In what county do you currently live?,{'1': '-'}
ZIPCODE1,VARCHAR,What is the ZIP Code where you currently live?,{'1': '-'}
NUMHHOL4,DOUBLE,"Not including cell phones or numbers used for computers, fax machines or security systems, do you have more","{'1': 'Yes', '2': 'No—Go to Section', '7': 'Don’t know/Not', '9': 'Refused—Go to', 'BLANK': 'Not asked or'}"
NUMPHON4,DOUBLE,How many of these landline telephone numbers are residential numbers?,"{'1': '-', '7': 'Don’t know/Not', '8': 'None', '9': 'Refused', 'BLANK': 'Not asked or'}"
CPDEMO1C,DOUBLE,How many cell phones do you have for your personal use? (Last question needed for partial complete.),"{'1': '-', '6': 'Six or more', '7': 'Don’t know/Not', '8': 'None', '9': 'Refused'}"
VETERAN3,DOUBLE,"Have you ever served on active duty in the United States Armed Forces, either in the regular military or in a","{'1': 'Yes', '2': 'No', '7': 'Don’t know/Not', '9': 'Refused', 'BLANK': 'Not asked or'}"
EMPLOY1,DOUBLE,Are you currently…?,"{'1': 'Employed for wages', '2': 'Self-employed', '3': 'Out of work for', '4': 'Out of work for', '5': 'A homemaker', '6': 'A student', '7': 'Retired', '8': 'Unable to work', '9': 'Refused', 'BLANK': 'Not asked or'}"
CHILDREN,DOUBLE,How many children less than 18 years of age live in your household?,"{'1': '-', '88': 'None', '99': 'Refused', 'BLANK': 'Not asked or'}"
INCOME3,DOUBLE,"Is your annual household income from all sources: (If respondent refuses at any income level, code ´Refused.´)","{'1': 'Less than $10,000', '2': 'Less than $15,000', '3': 'Less than $20,000', '4': 'Less than $25,000', '5': 'Less than $35,000', '6': 'Less than $50,000', '7': 'Less than $75,000', '8': 'Less than $100,000', '9': 'Less than $150,000', '10': 'Less than $200,000', '11': '$200,000 or more', '77': 'Don’t know/Not', '99': 'Refused', 'BLANK': 'Not asked or'}"
PREGNANT,DOUBLE,"To your knowledge, are you now pregnant?","{'1': 'Yes', '2': 'No', '7': 'Don’t know/Not', '9': 'Refused', 'BLANK': 'Not asked or'}"
WEIGHT2,DOUBLE,"About how much do you weigh without shoes? (If respondent answers in metrics, put a 9 in the first column)","{'50': '-', 'BLANK': 'Not asked or'}"
HEIGHT3,DOUBLE,"About how tall are you without shoes? (If respondent answers in metrics, put a 9 in the first column)[Round fractions down.]",{'BLANK': 'Not asked or'}
DEAF,DOUBLE,Are you deaf or do you have serious difficulty hearing?,"{'1': 'Yes', '2': 'No', '7': 'Don’t know/Not', '9': 'Refused', 'BLANK': 'Not asked or'}"
BLIND,DOUBLE,"Are you blind or do you have serious difficulty seeing, even when wearing glasses?","{'1': 'Yes', '2': 'No', '7': 'Don’t know/Not', '9': 'Refused', 'BLANK': 'Not asked or'}"
DECIDE,DOUBLE,"Because of a physical, mental, or emotional condition, do you have serious difficulty concentrating,","{'1': 'Yes', '2': 'No', '7': 'Don’t know/Not', '9': 'Refused', 'BLANK': 'Not asked or'}"
DIFFWALK,DOUBLE,Do you have serious difficulty walking or climbing stairs?,"{'1': 'Yes', '2': 'No', '7': 'Don’t know/Not', '9': 'Refused', 'BLANK': 'Not asked or'}"
DIFFDRES,DOUBLE,Do you have difficulty dressing or bathing?,"{'1': 'Yes', '2': 'No', '7': 'Don’t know/Not', '9': 'Refused', 'BLANK': 'Not asked or'}"
DIFFALON,DOUBLE,"Because of a physical, mental, or emotional condition, do you have difficulty doing errands alone such as visiting a doctor","{'1': 'Yes', '2': 'No', '7': 'Don’t know/Not', '9': 'Refused', 'BLANK': 'Not asked or'}"
FALL12MN,DOUBLE,"In the past 12 months, how many times have you fallen?","{'1': '-', '88': 'None—Go to Section', '99': 'Refused—Go to', 'BLANK': 'Missing'}"
FALLINJ5,DOUBLE,How many of these falls caused an injury that limited your regular activities for at least a day or caused you to go,"{'1': '-', '88': 'None', '77': 'Don’t know/Not', '99': 'or', 'BLANK': 'Missing'}"
SMOKE100,DOUBLE,Have you smoked at least 100 cigarettes in your entire life? [Note: 5 packs = 100 cigarettes],"{'1': 'Yes', '2': 'No—Go to Section', '7': 'Don’t know/Not', '9': 'Refused—Go to', 'BLANK': 'Not asked or'}"
SMOKDAY2,DOUBLE,"Do you now smoke cigarettes every day, some days, or not at all?","{'1': 'Every day', '2': 'Some days', '3': 'Not at all', '7': 'Don´t Know/Not', '9': 'Refused', 'BLANK': 'Not asked or'}"
USENOW3,DOUBLE,"Do you currently use chewing tobacco, snuff, or snus every day, some days, or not at all? (Snus (Swedish for","{'1': 'Every day', '2': 'Some days', '3': 'Not at all', '7': 'Don’t know/Not', '9': 'Refused', 'BLANK': 'Not asked or'}"
ECIGNOW2,DOUBLE,Would you say you have never used e-cigarettes or other electronic vaping products in your entire life or now,"{'1': 'Never used e-', '2': 'Use them every day', '3': 'Use them some days', '4': 'Not at all (right', '7': 'Don’t know / Not', '9': 'Refused', 'BLANK': 'Not asked or'}"
ALCDAY4,DOUBLE,"During the past 30 days, how many days per week or per month did you have at least one drink of any alcoholic","{'30': 'days—Go', 'BLANK': 'Not asked or'}"
AVEDRNK3,DOUBLE,"One drink is equivalent to a 12-ounce beer, a 5-ounce glass of wine, or a drink with one shot of liquor. During the past 30","{'1': '-', '88': 'None', '77': 'Don’t know/Not', '99': 'Refused', 'BLANK': 'Not asked or'}"
DRNK3GE5,DOUBLE,"Considering all types of alcoholic beverages, how many times during the past 30 days did you have 5 or more","{'1': '-', '88': 'None', '77': 'Don’t know/Not', '99': 'Refused', 'BLANK': 'Not asked or'}"
MAXDRNKS,DOUBLE,"During the past 30 days, what is the largest number of drinks you had on any occasion?","{'1': '-', '77': 'Don’t know/Not', '99': 'Refused', 'BLANK': 'Not asked or'}"
FLUSHOT7,DOUBLE,"During the past 12 months, have you had either flu vaccine that was sprayed in your nose or flu shot injected into your arm?","{'1': 'Yes', '2': 'No—Go to Section', '7': 'Don’t know/Not', '9': 'Refused—Go to', 'BLANK': '1,012'}"
FLSHTMY3,DOUBLE,During what month and year did you receive your most recent flu vaccine that was sprayed in your nose or flu,"{'BLANK': 'Not asked or', '9': 'or'}"
PNEUVAC4,DOUBLE,Have you ever had a pneumonia shot also known as a pneumococcal vaccine?,"{'1': 'Yes', '2': 'No', '7': 'Don’t know/Not', '9': 'Refused', 'BLANK': 'Not asked or'}"
SHINGLE2,DOUBLE,Have you ever had the shingles or zoster vaccine?,"{'1': 'Yes', '2': 'No', '7': 'Don’t know/Not', '9': 'Refused', 'BLANK': 'Not asked or'}"
HIVTST7,DOUBLE,"Including fluid testing from your mouth, but not including tests you may have had for blood donation, have you","{'1': 'Yes', '2': 'No—Go to Section', '7': 'Don’t know/Not', '9': 'Refused—Go to', 'BLANK': 'Not asked or'}"
HIVTSTD3,DOUBLE,"Not including blood donations, in what month and year was your last H.I.V. test? (If response is before January",{'BLANK': 'Not asked or'}
SEATBELT,DOUBLE,How often do you use seat belts when you drive or ride in a car? Would you say—,"{'1': 'Always', '2': 'Nearly always', '3': 'Sometimes', '4': 'Seldom', '5': 'Never', '7': 'Don’t know/Not', '8': 'Never drive or', '9': 'Refused', 'BLANK': 'Not asked or'}"
DRNKDRI2,DOUBLE,"During the past 30 days, how many times have you driven when you’ve had perhaps too much to drink?","{'1': '-', '88': 'None', '77': 'Don’t know/Not', '99': 'Refused', 'BLANK': 'Not asked or'}"
COVIDPO1,DOUBLE,"Have you ever tested positive for COVID-19 (using a rapid point-of-care test, self-test, or laboratory test) or been","{'1': 'Yes', '2': 'No—Go to Modules', '7': 'Don’t know/Not', '9': 'Refused—Go to', 'BLANK': 'Not asked or'}"
COVIDSM1,DOUBLE,Do you currently have symptoms lasting 3 months or longer that you did not have prior to having coronavirus or,"{'1': 'Yes', '2': 'No—Go to Modules', '7': 'Don’t know/Not', '9': 'Refused—Go to', 'BLANK': 'Not asked or'}"
COVIDACT,DOUBLE,Do these long-term symptoms reduce your ability to carry out day-to-day activities compared with the time,"{'1': 'Yes, a lot', '2': '7', '3': 'Not at all', '7': 'Don’t know/Not', '9': 'Refused', 'BLANK': 'Not asked or'}"
PDIABTS1,DOUBLE,"When was the last time you had a blood test for high blood sugar or diabetes by a doctor, nurse, or other health professional?","{'1': 'Within the past', '2': 'Within the past', '3': 'Within the past', '4': 'Within the past', '5': 'Within the past', '6': '10 or more years', '7': 'Don’t know / Not', '8': 'Never', '9': 'Refused', 'BLANK': 'Not asked or'}"
PREDIAB2,DOUBLE,Has a doctor or other health professional ever told you that you had prediabetes or borderline diabetes? (If,"{'1': 'Yes', '2': 'Yes, during', '3': 'No', '7': 'Don’t know/Not', '9': 'Refused', 'BLANK': 'Not asked or'}"
DIABTYPE,DOUBLE,"According to your doctor or other health professional, what type of diabetes do you have?","{'1': 'Type', '2': 'Type', '7': '9', '9': 'Refused', 'BLANK': 'Not asked or'}"
INSULIN1,DOUBLE,Are you now taking insulin?,"{'1': 'Yes', '2': 'No', '7': '9', 'BLANK': 'Not asked or'}"
CHKHEMO3,DOUBLE,"About how many times in the past 12 months has a doctor, nurse, or other health professional checked you for A-one-C?","{'1': '-', '88': 'None', '98': 'Never heard of “A', '77': 'Don’t know/Not', '99': 'Refused', 'BLANK': 'Not asked or', '7': '9'}"
EYEEXAM1,DOUBLE,"When was the last time you had an eye exam in which the pupils were dilated, making you temporarily sensitive","{'1': 'Within the past', '2': 'Within the past', '3': 'Within the past', '4': '2 or more years', '7': '9', '8': 'Never', '9': 'Refused', 'BLANK': 'Not asked or'}"
DIABEYE1,DOUBLE,"When was the last time a doctor, nurse or other health professional took a photo of the back of your eye with a","{'1': 'Within the past', '2': 'Within the past', '3': 'Within the past', '4': '2 or more years', '7': '9', '8': 'Never', '9': 'Refused', 'BLANK': 'Not asked or'}"
DIABEDU1,DOUBLE,When was the last time you took a course or class in how to manage your diabetes yourself?,"{'1': 'Within the past', '2': 'Within the last', '3': 'Within the last', '4': 'Within the last', '5': 'Within the last', '6': '10 years ago or', '7': '9', '8': 'Never', '9': 'Refused', 'BLANK': 'Not asked or'}"
FEETSORE,DOUBLE,Have you ever had any sores or irritations on your feet that took more than four weeks to heal?,"{'1': 'Yes', '2': 'No', '7': '9', 'BLANK': 'Not asked or'}"
ARTHEXER,VARCHAR,Has a doctor or other health professional ever suggested physical activity or exercise to help your arthritis or joint,{'BLANK': 'Not asked or'}
ARTHEDU,VARCHAR,Have you ever taken an educational course or class to teach you how to manage problems related to your,{'BLANK': 'Not asked or'}
LMTJOIN3,VARCHAR,Are you now limited in any way in any of your usual activities because of arthritis or joint symptoms?,{'BLANK': 'Not asked or'}
ARTHDIS2,VARCHAR,"Do arthritis or joint symptoms now affect whether you work, the type of work you do or the amount of work you do?",{'BLANK': 'Missing'}
JOINPAI2,VARCHAR,"During the past 30 days, how bad was your joint pain on average on a scale of 0 to 10 where 0 is no pain and 10",{'BLANK': 'Missing'}
LCSFIRST,VARCHAR,How old were you when you first started to smoke cigarettes regularly,"{'BLANK': 'Not asked or', '7': '9'}"
LCSLAST,VARCHAR,How old were you when you last smoked cigarettes regularly?,{'BLANK': 'Not asked or'}
LCSNUMCG,VARCHAR,"On average, when you smoke/smoked regularly, about how many cigarettes do/did you usually smoke each day?","{'BLANK': 'Not asked or', '7': '9'}"
LCSCTSC1,VARCHAR,Have you ever had a CT or CAT scan of your chest area?,{'BLANK': 'Not asked or'}
